UlasanNormal,UlasanStop,UlasanStem
"['pengiriman', 'cepat', 'packing', 'bagus', 'hp', 'super', 'kw', 'waktu', 'power', 'hp', 'dinyalakan', 'tidak', 'ada', 'tulisan', 'powered', 'by', 'android', 'aplikasi', 'wa', 'susah', 'untuk', 'menerima', 'tidak', 'verifikasi', 'aplikasi', 'sms']","['pengiriman', 'cepat', 'packing', 'bagus', 'hp', 'super', 'kw', 'power', 'hp', 'dinyalakan', 'tulisan', 'powered', 'by', 'android', 'aplikasi', 'wa', 'susah', 'menerima', 'verifikasi', 'aplikasi', 'sms']",kirim cepat packing bagus hp super kw waktu power hp nyala tidak ada tulis powered by android aplikasi wa susah untuk terima tidak verifikasi aplikasi sms
"['barang', 'bagus', 'packing', 'ok', 'dan', 'cepat', 'sampe']","['barang', 'bagus', 'packing', 'ok', 'cepat', 'sampe']",barang bagus packing ok dan cepat sampe
"['hp', 'jelek']","['hp', 'jelek']",hp jelek
"['barang', 'sudah', 'ditrrima', 'dengan', 'sangat', 'baiksemua', 'berfungsi', 'normalterima', 'kasih', 'seller', 'sudah', 'fast', 'responpengiriman', 'lebih', 'cepat', 'dari', 'jadwal']","['barang', 'ditrrima', 'baiksemua', 'berfungsi', 'normalterima', 'kasih', 'seller', 'fast', 'responpengiriman', 'cepat', 'jadwal']",barang sudah ditrrima dengan sangat baiksemua fungsi normalterima kasih seller sudah fast responpengiriman lebih cepat dari jadwal
"['sudah', 'mau', 'sebulan', 'pemakaian', 'alhamdulillah', 'tidak', 'ada', 'keanehan', 'mudah-mudahan', 'awet', 'aamiin']","['sebulan', 'pemakaian', 'alhamdulillah', 'keanehan', 'mudah-mudahan', 'awet', 'aamiin']",sudah mau bulan pakai alhamdulillah tidak ada aneh mudah awet aamiin
['oke'],['oke'],oke
"['hpnya', 'cepat', 'sampai', 'tokonya', 'gast', 'respon', 'tetapi', 'hpnya', 'buat', 'absensi', 'di', 'simpatika', 'nggak', 'bisa', 'karena', 'hp', 'dii', 'root', 'bagaimana', 'soluainya']","['hpnya', 'cepat', 'tokonya', 'gast', 'respon', 'hpnya', 'absensi', 'simpatika', 'nggak', 'hp', 'dii', 'root', 'soluainya']",hpnya cepat sampai toko gast respon tetapi hpnya buat absensi di simpatika nggak bisa karena hp dii root bagaimana soluainya
"['kualitas', 'dunia']","['kualitas', 'dunia']",kualitas dunia
"['tidak', 'jls', 'merk', 'nya']","['jls', 'merk', 'nya']",tidak jls merk nya
"['bukan', 'realme', 'itu', 'kesal', 'banget', 'mau', 'jual', 'hp', 'camon', 'pro']","['realme', 'kesal', 'banget', 'jual', 'hp', 'camon', 'pro']",bukan realme itu kesal banget mau jual hp camon pro
"['dengan', 'harga', 'bersaing', 'produk', 'berada', 'di', 'atas', 'produk', 'lain']","['harga', 'bersaing', 'produk', 'produk']",dengan harga saing produk ada di atas produk lain
"['barang', 'tidak', 'sesuai', 'dikripsi', 'tidak', 'bisa', 'terhubung', 'ke', 'jaringan', 'internet', 'kamera', 'sangat', 'buruk']","['barang', 'sesuai', 'dikripsi', 'terhubung', 'jaringan', 'internet', 'kamera', 'buruk']",barang tidak sesuai dikripsi tidak bisa hubung ke jaring internet kamera sangat buruk
"['barang', 'diterima', 'dan', 'berfungsi', 'dengan', 'baik', 'sesuai', 'spesifikasipacking', 'aman', '&', 'pengiriman', 'cepat', 'semoga', 'awetrecomemded', 'seller']","['barang', 'diterima', 'berfungsi', 'sesuai', 'spesifikasipacking', 'aman', '&', 'pengiriman', 'cepat', 'semoga', 'awetrecomemded', 'seller']",barang terima dan fungsi dengan baik sesuai spesifikasipacking aman  kirim cepat moga awetrecomemded seller
"['ponsel', 'ini', 'berjalan', 'dengan', 'lancar', 'perangkat', 'lunaknya', 'terbuka', 'dengan', 'cepat', 'mengambil', 'foto', 'yang', 'bagus', 'dan', 'mengambil', 'gambar', 'yang', 'bagus', 'saya', 'memberikannya', 'kepada', 'istri', 'sa']","['ponsel', 'berjalan', 'lancar', 'perangkat', 'lunaknya', 'terbuka', 'cepat', 'mengambil', 'foto', 'bagus', 'mengambil', 'gambar', 'bagus', 'memberikannya', 'istri', 'sa']",ponsel ini jalan dengan lancar perangkat lunak buka dengan cepat ambil foto yang bagus dan ambil gambar yang bagus saya beri kepada istri sa
"['logistik', 'yang', 'sangat', 'cepat', 'pengiriman', 'hari', 'kecepatan', 'lari', 'juga', 'sangat', 'kuat', 'respons', 'terhadap', 'permintaan', 'layanan', 'pelanggan', 'juga', 'ditempatkan', 'dengan', 'sangat', 'baik']","['logistik', 'cepat', 'pengiriman', 'kecepatan', 'lari', 'kuat', 'respons', 'permintaan', 'layanan', 'pelanggan', 'ditempatkan']",logistik yang sangat cepat kirim hari cepat lari juga sangat kuat respons hadap minta layan langgan juga tempat dengan sangat baik
"['recommended', 'hp', 'recoment', 'toko', 'good', 'seller', 'good', 'produk', 'sukses', 'selalu', 'yh', 'admin', 'dan', 'kurir', 'smh', 'makin', 'laris']","['recommended', 'hp', 'recoment', 'toko', 'good', 'seller', 'good', 'produk', 'sukses', 'yh', 'admin', 'kurir', 'smh', 'laris']",recommended hp recoment toko good seller good produk sukses selalu yh admin dan kurir smh makin laris
"['alhamdulillah', 'nyampe', 'dengan', 'selamat', 'dengan', 'keadaan', 'baikpenjual', 'nya', 'juga', 'gercep', 'banget', 'lngsung', 'dproses', 'tpi', 'tidak', 'ada', 'bonus', 'bonusan', 'nya']","['alhamdulillah', 'nyampe', 'selamat', 'baikpenjual', 'nya', 'gercep', 'banget', 'lngsung', 'dproses', 'tpi', 'bonus', 'bonusan', 'nya']",alhamdulillah nyampe dengan selamat dengan ada baikpenjual nya juga gercep banget lngsung dproses tpi tidak ada bonus bonus nya
"['ini', 'adalah', 'toko', 'asli', 'dengan', 'pelayanan', 'yang', 'baik', 'harganya', 'lebih', 'murah', 'daripada', 'toko', 'fisik', 'anda', 'bisa', 'membelinya']","['toko', 'asli', 'pelayanan', 'harganya', 'murah', 'toko', 'fisik', 'membelinya']",ini adalah toko asli dengan layan yang baik harga lebih murah daripada toko fisik anda bisa bel
"['barang', 'sudah', 'datang', 'hpnya', 'sesuai', 'dengan', 'yang', 'dijuall', 'puas', 'sekali', 'terimakadih', 'seller', 'yang', 'begitu', 'ramah', 'barang', 'sudah', 'dampe', 'alhamdulillah', 'kondisi', 'ho', 'lancar', 'baikkk', 'kemasan']","['barang', 'hpnya', 'sesuai', 'dijuall', 'puas', 'terimakadih', 'seller', 'ramah', 'barang', 'dampe', 'alhamdulillah', 'kondisi', 'ho', 'lancar', 'baikkk', 'kemasan']",barang sudah datang hpnya sesuai dengan yang dijuall puas sekali terimakadih seller yang begitu ramah barang sudah dampe alhamdulillah kondisi ho lancar baikkk kemas
"['kamera', 'depan', 'kamera', 'belakan', 'oke', 'bingitttt', 'alhamdulillah', 'barang', 'dikirim', 'cepet', 'seneng', 'bisa', 'order', 'ditoko', 'ini', 'produknya', 'tidak', 'mengecewakan', 'respon', 'seller', 'juga', 'baguss', 'dan', 'handp']","['kamera', 'kamera', 'belakan', 'oke', 'bingitttt', 'alhamdulillah', 'barang', 'dikirim', 'cepet', 'seneng', 'order', 'ditoko', 'produknya', 'mengecewakan', 'respon', 'seller', 'baguss', 'handp']",kamera depan kamera bela oke bingitttt alhamdulillah barang kirim cepet neng bisa order toko ini produk tidak kecewa respon seller juga baguss dan handp
"['mantap', 'saya', 'pesan', 'dari', 'toko', 'ini', 'saya', 'suka', 'banget', 'hpnya', 'bagus', 'dan', 'batrainya', 'awet', 'cukup', 'saya', 'suka', 'terima kasih', 'sudah', 'amanah', 'sukses', 'selalu', 'penjual', 'ini', 'terima kasih', 'paket', 'telah', 'dite']","['mantap', 'pesan', 'toko', 'suka', 'banget', 'hpnya', 'bagus', 'batrainya', 'awet', 'suka', 'terima kasih', 'amanah', 'sukses', 'penjual', 'terima kasih', 'paket', 'dite']",mantap saya pesan dari toko ini saya suka banget hpnya bagus dan batrainya awet cukup saya suka terima kasih sudah amanah sukses selalu jual ini terima kasih paket telah dite
"['pertama', 'kali', 'melakukan', 'pre-order', 'rilisan', 'baru', 'hp', 'hp', 'mencobanya', 'dan', 'sangat', 'senang', 'dengan', 'itu', 'desain', 'yang', 'sangat', 'mewah', 'tekstur', 'yang', 'bagus', 'dan', 'fitur-fitur', 'yang', 'hebat']","['kali', 'pre-order', 'rilisan', 'hp', 'hp', 'mencobanya', 'senang', 'desain', 'mewah', 'tekstur', 'bagus', 'fitur-fitur', 'hebat']",pertama kali laku pre-order rilis baru hp hp coba dan sangat senang dengan itu desain yang sangat mewah tekstur yang bagus dan fitur-fitur yang hebat
"['langsung', 'dibuka', 'di', 'depan', 'kurir', 'alhamdulillah', 'barang', 'sesuai', 'spek', 'aman', 'packing', 'aman', 'dan', 'kurir', 'sudah', 'langganan', 'terima kasih', 'seller', 'terima kasih', 'buat', 'abang', 'kurirnya', 'juga', 'toko', 'am']","['langsung', 'dibuka', 'kurir', 'alhamdulillah', 'barang', 'sesuai', 'spek', 'aman', 'packing', 'aman', 'kurir', 'langganan', 'terima kasih', 'seller', 'terima kasih', 'abang', 'kurirnya', 'toko', 'am']",langsung buka di depan kurir alhamdulillah barang sesuai spek aman packing aman dan kurir sudah langgan terima kasih seller terima kasih buat abang kurir juga toko am
"['hp', 'baru', 'tetapi', 'sudah', 'banyak', 'pencarian', 'di', 'google']","['hp', 'pencarian', 'google']",hp baru tetapi sudah banyak cari di google
"['hpnya', 'reno', 'abal']","['hpnya', 'reno', 'abal']",hpnya reno abal
"['barang', 'bagus', 'berfungsi', 'dengan', 'baik', 'proses', 'cepat', 'pengiriman', 'cepat']","['barang', 'bagus', 'berfungsi', 'proses', 'cepat', 'pengiriman', 'cepat']",barang bagus fungsi dengan baik proses cepat kirim cepat
"['fisik', 'tabletnya', 'dak', 'sesuai', 'gambar', 'framenya', 'di', 'foto', 'iklan', 'frameless', 'tipis', 'framenya', 'tetapi', 'kenyataan', 'nya', 'lebar', 'prosesornya', 'agak', 'leletsuka', 'ngelack']","['fisik', 'tabletnya', 'dak', 'sesuai', 'gambar', 'framenya', 'foto', 'iklan', 'frameless', 'tipis', 'framenya', 'kenyataan', 'nya', 'lebar', 'prosesornya', 'leletsuka', 'ngelack']",fisik tablet dak sesuai gambar framenya di foto iklan frameless tipis framenya tetapi nyata nya lebar prosesor agak leletsuka ngelack
"['barang', 'yang', 'dijual', 'tidak', 'sesuai', 'dengan', 'spek', 'ram', '&', 'kwalitas', 'foto', 'tidak', 'sesuai', 'yang', 'ditawarkanð\x9f\x99\x8f']","['barang', 'dijual', 'sesuai', 'spek', 'ram', '&', 'kwalitas', 'foto', 'sesuai', 'ditawarkanð\x9f\x99\x8f']",barang yang jual tidak sesuai dengan spek ram  kwalitas foto tidak sesuai yang tawar
"['hp', 'ok']","['hp', 'ok']",hp ok
"['hp', 'sudah', 'diterima', 'dan', 'berfungsi', 'normal', 'tolong', 'dibantu', 'garansi', 'apabila', 'ada', 'kendala', 'pada', 'perangkat']","['hp', 'diterima', 'berfungsi', 'normal', 'tolong', 'dibantu', 'garansi', 'kendala', 'perangkat']",hp sudah terima dan fungsi normal tolong bantu garansi apabila ada kendala pada perangkat
"['barang', 'tidak', 'sesuai', 'pesanan', 'pesan', 'note', 'pro', 'yang', 'datan', 'camon', 'pro']","['barang', 'sesuai', 'pesanan', 'pesan', 'note', 'pro', 'datan', 'camon', 'pro']",barang tidak sesuai pesan pesan note pro yang datan camon pro
"['terima', 'kasih', 'telah', 'menipu', 'saya', 'kalau', 'jual', 'harus', 'jujur', 'saya', 'pesan', 'merk', 'real', 'yang', 'datang', 'merk', 'lain', 'spek', 'hp', 'cina', 'jangan', 'percaya', 'toko', 'ini', 'sangat', 'tidak', 'sesuai', 'dengan', 'apa']","['terima', 'kasih', 'menipu', 'jual', 'jujur', 'pesan', 'merk', 'real', 'merk', 'spek', 'hp', 'cina', 'percaya', 'toko', 'sesuai']",terima kasih telah tipu saya kalau jual harus jujur saya pesan merk real yang datang merk lain spek hp cina jangan percaya toko ini sangat tidak sesuai dengan apa
"['terimakasi', 'spek', 'sesuai', 'bagus', 'banget', 'alhamdulillah']","['terimakasi', 'spek', 'sesuai', 'bagus', 'banget', 'alhamdulillah']",terimakasi spek sesuai bagus banget alhamdulillah
"['barang', 'ok', 'sesuai', 'pesanan', 'cepat', 'sampai', 'mudahan', 'awet', 'recommended', 'jempol']","['barang', 'ok', 'sesuai', 'pesanan', 'cepat', 'mudahan', 'awet', 'recommended', 'jempol']",barang ok sesuai pesan cepat sampai mudah awet recommended jempol
"['barang', 'nya', 'bgs', 'lumayan', 'lah']","['barang', 'nya', 'bgs', 'lumayan']",barang nya bgs lumayan lah
"['mntap', 'lah', 'sesuaidg', 'harganya']","['mntap', 'sesuaidg', 'harganya']",mntap lah sesuaidg harga
"['bagus', 'recomended']","['bagus', 'recomended']",bagus recomended
"['hp', 'sudah', 'diterima', 'dengan', 'baik', 'semoga', 'tiidak', 'ada', 'kendala', 'perangkat', 'dan', 'program', 'mohon', 'dibantu', 'garansi', 'apabila', 'ada', 'kendala']","['hp', 'diterima', 'semoga', 'tiidak', 'kendala', 'perangkat', 'program', 'mohon', 'dibantu', 'garansi', 'kendala']",hp sudah terima dengan baik moga tiidak ada kendala perangkat dan program mohon bantu garansi apabila ada kendala
[],[],
"['overall', 'bagus', 'masalahnya', 'batere', 'parah', '%', 'cuma', 'dihidupin', 'cek', 'fitur', 'browsing', 'tidak', 'sampai', 'mnt', 'kandas', 'baterenya']","['overall', 'bagus', 'batere', 'parah', '%', 'dihidupin', 'cek', 'fitur', 'browsing', 'mnt', 'kandas', 'baterenya']",overall bagus masalah batere parah  cuma dihidupin cek fitur browsing tidak sampai mnt kandas baterenya
"['barang', 'masih', 'bagus', 'masih', 'segel', 'sudah', 'coba', 'oke', 'banget', 'kualitas', 'sesuai', 'harga', 'pokoknya', 'mantab', 'deh']","['barang', 'bagus', 'segel', 'coba', 'oke', 'banget', 'kualitas', 'sesuai', 'harga', 'pokoknya', 'mantab', 'deh']",barang masih bagus masih segel sudah coba oke banget kualitas sesuai harga pokok mantab deh
"['alhamdulillah', 'paket', 'sudah', 'sampai', 'dengan', 'selamat', 'hp', 'sudah', 'saya', 'buka', 'hp', 'bagus', 'kamera', 'jernih', 'isi', 'box', 'lengkap', 'hp', 'cepat', 'hp', 'diterima', 'dengan', 'selamat', 'pengemasan', 'dan', 'pengir']","['alhamdulillah', 'paket', 'selamat', 'hp', 'buka', 'hp', 'bagus', 'kamera', 'jernih', 'isi', 'box', 'lengkap', 'hp', 'cepat', 'hp', 'diterima', 'selamat', 'pengemasan', 'pengir']",alhamdulillah paket sudah sampai dengan selamat hp sudah saya buka hp bagus kamera jernih isi box lengkap hp cepat hp terima dengan selamat emas dan kir
"['yeah', 'akhirnya', 'barang', 'sampai', 'dengan', 'aman', 'fitur', 'lengkap', 'ada', 'casan', 'headset', 'softcase', 'tempered', 'glass', 'semua', 'berjalan', 'dengan', 'baik', 'seller', 'ramah', 'kurir', 'amanah', 'pengiriman']","['yeah', 'barang', 'aman', 'fitur', 'lengkap', 'casan', 'headset', 'softcase', 'tempered', 'glass', 'berjalan', 'seller', 'ramah', 'kurir', 'amanah', 'pengiriman']",yeah akhir barang sampai dengan aman fitur lengkap ada cas headset softcase tempered glass semua jalan dengan baik seller ramah kurir amanah kirim
"['kualitas', 'produk', 'sangat', 'baik', 'spek', 'nya', 'bagus', 'worth', 'it', 'pengemasan', 'cukup', 'baik', 'produknya', 'masih', 'aman', 'pengiriman', 'jauh', 'lebih', 'cepat', 'dari', 'pada', 'estimasinya', 'thank', 'you', 'seller']","['kualitas', 'produk', 'spek', 'nya', 'bagus', 'worth', 'it', 'pengemasan', 'produknya', 'aman', 'pengiriman', 'cepat', 'estimasinya', 'thank', 'you', 'seller']",kualitas produk sangat baik spek nya bagus worth it emas cukup baik produk masih aman kirim jauh lebih cepat dari pada estimasi thank you seller
"['saya', 'sangat', 'puas', 'saya', 'telah', 'menggunakannya', 'untuk', 'sementara', 'waktu', 'dan', 'memiliki', 'kapasitas', 'penyimpanan', 'baterai', 'yang', 'kuat', 'jika', 'hanya', 'digunakan', 'untuk', 'menjawab', 'dan', 'membu']","['puas', 'menggunakannya', 'memiliki', 'kapasitas', 'penyimpanan', 'baterai', 'kuat', 'membu']",saya sangat puas saya telah guna untuk sementara waktu dan milik kapasitas simpan baterai yang kuat jika hanya guna untuk jawab dan membu
"['pengiriman', 'cepat', 'tubuhnya', 'cerah', 'dan', 'tipis', 'dengan', 'warna', 'yang', 'indah', 'sangat', 'indah', 'cukup', 'ingatan', 'prosesor', 'licin', 'hidup', 'baterai', 'panjang', 'disediakan', 'dengan', 'pencari', 'mudah']","['pengiriman', 'cepat', 'tubuhnya', 'cerah', 'tipis', 'warna', 'indah', 'indah', 'ingatan', 'prosesor', 'licin', 'hidup', 'baterai', 'disediakan', 'pencari', 'mudah']",kirim cepat tubuh cerah dan tipis dengan warna yang indah sangat indah cukup ingat prosesor licin hidup baterai panjang sedia dengan cari mudah
"['teleponnya', 'dibeli', 'untuk', 'ibuku', 'dengan', 'warna', 'yang', 'sangat', 'indah', 'kecepatan', 'berjalan', 'yang', 'baik', 'foto-foto', 'yang', 'jelas', 'dan', 'yang', 'paling', 'penting', 'itu', 'memiliki', 'biaya-efekti']","['teleponnya', 'dibeli', 'ibuku', 'warna', 'indah', 'kecepatan', 'berjalan', 'foto-foto', 'memiliki', 'biaya-efekti']",telepon beli untuk ibu dengan warna yang sangat indah cepat jalan yang baik foto yang jelas dan yang paling penting itu milik biaya-efekti
"['-', 'oke', 'bernilai', 'membeli', 'kembali', 'ponselnya', 'efisien', 'baterai', 'dan', 'bertahan', 'kecepatan', 'muatan', 'cepat', 'harganya', 'moderat', 'efek', 'foto', 'besar', 'ponsel', 'ringan', 'dan', 'nyaman', 'dan', 'nyaman']","['-', 'oke', 'bernilai', 'membeli', 'ponselnya', 'efisien', 'baterai', 'bertahan', 'kecepatan', 'muatan', 'cepat', 'harganya', 'moderat', 'efek', 'foto', 'ponsel', 'ringan', 'nyaman', 'nyaman']",- oke nila beli kembali ponselnya efisien baterai dan tahan cepat muat cepat harga moderat efek foto besar ponsel ringan dan nyaman dan nyaman
"['kualitas', 'memuaskan', 'paket', 'sampai', 'dengan', 'baiktanpa', 'ada', 'masalah', 'barang', 'sesuai', 'harapan', 'pengiriman', 'cepat', 'banyak', 'pilihan', 'produk', 'hp', 'nya', 'dalam', 'kondisi', 'mulus', 'dapet', 'harga', 'segitu']","['kualitas', 'memuaskan', 'paket', 'baiktanpa', 'barang', 'sesuai', 'harapan', 'pengiriman', 'cepat', 'pilihan', 'produk', 'hp', 'nya', 'kondisi', 'mulus', 'dapet', 'harga', 'segitu']",kualitas muas paket sampai dengan baiktanpa ada masalah barang sesuai harap kirim cepat banyak pilih produk hp nya dalam kondisi mulus dapet harga segitu
"['alhamdulillah', 'barang', 'datang', 'dengan', 'selamat', 'cepat', 'lagi', 'pengirimannya', 'tadinya', 'sih', 'was', 'was', 'karena', 'belum', 'pernah', 'beli', 'hp', 'secara', 'online', 'tetapi', 'terpercaya', 'lah', 'terima kasih', 'buat', 'tok']","['alhamdulillah', 'barang', 'selamat', 'cepat', 'pengirimannya', 'sih', 'was', 'was', 'beli', 'hp', 'online', 'terpercaya', 'terima kasih', 'tok']",alhamdulillah barang datang dengan selamat cepat lagi kirim tadi sih was was karena belum pernah beli hp cara online tetapi percaya lah terima kasih buat tok
"['tampaknya', 'tinggi', 'harga', 'yang', 'cocokð\x9f\x92\x95', 'operasi', 'cepat', 'sangat', 'puas', 'dengan', 'menonton', 'film', 'dan', 'mendengarkan', 'musikð\x9f\x98\x86ð\x9f\x98\x86', 'dan', 'sangat', 'puas', 'dengan', 'fungsi', 'kamerað\x9f¥°ð\x9f¥°', 'saya', 'hanya', 'raj']","['harga', 'cocokð\x9f\x92\x95', 'operasi', 'cepat', 'puas', 'menonton', 'film', 'mendengarkan', 'musikð\x9f\x98\x86ð\x9f\x98\x86', 'puas', 'fungsi', 'kamerað\x9f¥°ð\x9f¥°', 'raj']",tampak tinggi harga yang cocok operasi cepat sangat puas dengan tonton film dan dengar musik dan sangat puas dengan fungsi kamera saya hanya raj
"['mantap', 'barang', 'mulus', 'seperti', 'baru', 'walpun', 'murah', 'juga', 'kualitas', 'tidak', 'murahan', 'terbaik', 'tokonya', 'mantap', 'semoga', 'bisa', 'beli', 'lagi', 'taun', 'depan']","['mantap', 'barang', 'mulus', 'walpun', 'murah', 'kualitas', 'murahan', 'terbaik', 'tokonya', 'mantap', 'semoga', 'beli', 'taun']",mantap barang mulus seperti baru walpun murah juga kualitas tidak murah baik toko mantap moga bisa beli lagi taun depan
"['belanja', 'disini', 'puass', 'barang', 'berkualitas', 'rekomend', 'banget', 'produk', 'sesuai', 'digambar', 'barang', 'datang', 'dengan', 'aman', 'dan', 'lengkap', 'puasss', 'kakak', 'terima kasih']","['belanja', 'puass', 'barang', 'berkualitas', 'rekomend', 'banget', 'produk', 'sesuai', 'digambar', 'barang', 'aman', 'lengkap', 'puasss', 'kakak', 'terima kasih']",belanja sini puass barang kualitas rekomend banget produk sesuai gambar barang datang dengan aman dan lengkap puasss kakak terima kasih
"['akhirnya', 'sampe', 'dgn', 'amantidak', 'ada', 'kerusakan', 'dan', 'berfungsi', 'dgn', 'baik', 'jugaseller', 'ramah', 'mantapp']","['sampe', 'dgn', 'amantidak', 'kerusakan', 'berfungsi', 'dgn', 'jugaseller', 'ramah', 'mantapp']",akhir sampe dgn amantidak ada rusa dan fungsi dgn baik jugaseller ramah mantapp
"['gooddan', 'realpict', 'juga', 'hp', 'yang', 'saya', 'pesantanpa', 'kekurangan', 'sedikitpun', 'terima kasih']","['gooddan', 'realpict', 'hp', 'pesantanpa', 'kekurangan', 'sedikitpun', 'terima kasih']",gooddan realpict juga hp yang saya pesantanpa kurang sedikit terima kasih
"['dengann', 'hargaa', 'segtu', 'lumbayan', 'bagus', 'bangetdesign', 'nya', 'bagus', 'kualitasnyaa', 'bagus', 'terima kasih', 'toko', 'sudah', 'amanah', 'ð\x9f\x99\x8f']","['dengann', 'hargaa', 'segtu', 'lumbayan', 'bagus', 'bangetdesign', 'nya', 'bagus', 'kualitasnyaa', 'bagus', 'terima kasih', 'toko', 'amanah', 'ð\x9f\x99\x8f']",dengann hargaa segtu lumbayan bagus bangetdesign nya bagus kualitasnyaa bagus terima kasih toko sudah amanah 
"['sesuai', 'keinginan', 'karena', 'mesan', 'tanpa', 'ragu', 'dan', 'seneng', 'juga', 'masih', 'mulus', 'tanpa', 'lecet', 'sedikitpun', 'tidak ada', 'kurangnya', 'sama', 'sekali', 'admin', 'juga', 'ramah', 'amanah']","['sesuai', 'mesan', 'ragu', 'seneng', 'mulus', 'lecet', 'sedikitpun', 'tidak ada', 'kurangnya', 'admin', 'ramah', 'amanah']",sesuai ingin karena mesan tanpa ragu dan neng juga masih mulus tanpa lecet sedikit tidak ada kurang sama sekali admin juga ramah amanah
"['terima kasih', 'seller', 'sudah', 'menjual', 'brng', 'dengan', 'amanah', 'tidak', 'kecewa', 'deh', 'beli', 'disini', 'ori', 'dan', 'lengkap', 'brng', 'nya']","['terima kasih', 'seller', 'menjual', 'brng', 'amanah', 'kecewa', 'deh', 'beli', 'ori', 'lengkap', 'brng', 'nya']",terima kasih seller sudah jual brng dengan amanah tidak kecewa deh beli sini ori dan lengkap brng nya
"['akhirnya', 'sampe', 'jga', 'dgn', 'amanmantapp', 'deh', 'pokoknyathanks', 'terima kasih']","['sampe', 'jga', 'dgn', 'amanmantapp', 'deh', 'pokoknyathanks', 'terima kasih']",akhir sampe jga dgn amanmantapp deh pokoknyathanks terima kasih
"['terima kasih', 'banyak', 'yaa', 'seller', 'paketnya', 'sudah', 'sampai', 'dengan', 'baik', 'mantap', 'betul', 'dah', 'next', 'order', 'hp', 'lagi', 'disini']","['terima kasih', 'yaa', 'seller', 'paketnya', 'mantap', 'dah', 'next', 'order', 'hp']",terima kasih banyak yaa seller paket sudah sampai dengan baik mantap betul dah next order hp lagi sini
"['terima kasih', 'yahh', 'paket', 'sudah', 'saya', 'terima', 'bagus', 'dan', 'menarik', 'tampilan', 'nya', 'sangat', 'oke', 'banget', 'dehhh']","['terima kasih', 'yahh', 'paket', 'terima', 'bagus', 'menarik', 'tampilan', 'nya', 'oke', 'banget', 'dehhh']",terima kasih yahh paket sudah saya terima bagus dan tarik tampil nya sangat oke banget dehhh
"['alhamdulillah', 'mendarat', 'dengan', 'selamat', 'thank', 'you', 'seller', 'berfungsi', 'dengan', 'baik', 'jugano', 'cacat', 'ð\x9f\x98\x8dð\x9f\x98\x8dð\x9f\x91\x8dð\x9f\x91\x8d']","['alhamdulillah', 'mendarat', 'selamat', 'thank', 'you', 'seller', 'berfungsi', 'jugano', 'cacat', 'ð\x9f\x98\x8dð\x9f\x98\x8dð\x9f\x91\x8dð\x9f\x91\x8d']",alhamdulillah darat dengan selamat thank you seller fungsi dengan baik jugano cacat 
"['alhamdulillah', 'paket', 'sudah', 'diterima', 'dengan', 'baik', 'packing', 'rapih', 'brng', 'yang', 'di', 'terima', 'sesuai', 'pesanan', 'semoga', 'pelayanan', 'after', 'sales-nya', 'terus', 'terjaga', 'terima kasih', 'recommended', 'sel']","['alhamdulillah', 'paket', 'diterima', 'packing', 'rapih', 'brng', 'terima', 'sesuai', 'pesanan', 'semoga', 'pelayanan', 'after', 'sales-nya', 'terjaga', 'terima kasih', 'recommended', 'sel']",alhamdulillah paket sudah terima dengan baik packing rapih brng yang di terima sesuai pesan moga layan after sales-nya terus jaga terima kasih recommended sel
"['baru', 'pertama', 'nya', 'belanja', 'handphone', 'di', 'toko', 'inisangat', 'amanah', 'sekali', 'tokonyaproduk', 'aslisesuai', 'dengan', 'pesananbonus', 'kartu', 'lagilengkap', 'semuakeren', 'banget', 'lah', 'poko']","['nya', 'belanja', 'handphone', 'toko', 'inisangat', 'amanah', 'tokonyaproduk', 'aslisesuai', 'pesananbonus', 'kartu', 'lagilengkap', 'semuakeren', 'banget', 'poko']",baru pertama nya belanja handphone di toko inisangat amanah sekali tokonyaproduk aslisesuai dengan pesananbonus kartu lagilengkap semuakeren banget lah poko
"['first', 'time', 'beli', 'hp', 'secara', 'online', 'pengemasan', 'dan', 'pengiriman', 'aman', 'dan', 'cepat', 'kondisi', 'sangat', 'bagus', 'box', 'segel', 'cas', 'case', 'kartu', 'earphone', 'garansi', 'dll', 'dapat', 'dgn', 'baik', 'diterima']","['first', 'time', 'beli', 'hp', 'online', 'pengemasan', 'pengiriman', 'aman', 'cepat', 'kondisi', 'bagus', 'box', 'segel', 'cas', 'case', 'kartu', 'earphone', 'garansi', 'dll', 'dgn', 'diterima']",first time beli hp cara online emas dan kirim aman dan cepat kondisi sangat bagus box segel cas case kartu earphone garansi dll dapat dgn baik terima
"['hp', 'original', 'pengiriman', 'kilat', 'dikemas', 'dengan', 'aman', 'terima kasih', 'yahh', 'wajib', 'order', 'disini', 'kualitas', 'terjamin', 'bgttt', 'percaya', 'deh']","['hp', 'original', 'pengiriman', 'kilat', 'dikemas', 'aman', 'terima kasih', 'yahh', 'wajib', 'order', 'kualitas', 'terjamin', 'bgttt', 'percaya', 'deh']",hp original kirim kilat kemas dengan aman terima kasih yahh wajib order sini kualitas jamin bgttt percaya deh
"['mantap', 'puas', 'banget', 'belanja', 'di', 'sini', 'barang', 'sampai', 'dengan', 'aman', 'peninggi', 'sangat', 'aman', 'sipï¼\x8cpaketan', 'cpt', 'aman', 'terkendali', 'smg', 'hp', 'awet', 'dipake', 'bwt', 'ank', 'keperluan', 'sekolahnyaalhamdul']","['mantap', 'puas', 'banget', 'belanja', 'barang', 'aman', 'peninggi', 'aman', 'sipï¼\x8cpaketan', 'cpt', 'aman', 'terkendali', 'smg', 'hp', 'awet', 'dipake', 'bwt', 'ank', 'keperluan', 'sekolahnyaalhamdul']",mantap puas banget belanja di sini barang sampai dengan aman tinggi sangat aman sip paket cpt aman kendali smg hp awet dipake bwt ank perlu sekolahnyaalhamdul
