UlasanNormal,UlasanStop,UlasanStem
"['ponsel', 'ini', 'adalah', 'ponsel', 'favorit', 'saya', 'fotografi', 'bagus', 'di', 'semua', 'aspek', 'saya', 'akan', 'memeriksanya', 'setelah', 'menggunakannya', 'untuk', 'sementara', 'waktu']","['ponsel', 'ponsel', 'favorit', 'fotografi', 'bagus', 'aspek', 'memeriksanya', 'menggunakannya']",ponsel ini adalah ponsel favorit saya fotografi bagus di semua aspek saya akan periksa telah guna untuk sementara waktu
"['saya', 'sangat', 'puas', 'dengan', 'bayi', 'ini', 'telah', 'digunakan', 'untuk', 'sementara', 'waktu', 'sangat', 'baik', 'untuk', 'bermain', 'permainan']","['puas', 'bayi', 'bermain', 'permainan']",saya sangat puas dengan bayi ini telah guna untuk sementara waktu sangat baik untuk main main
"['kualitas', 'ponsel', 'sangat', 'baik', 'ini', 'asli', 'berjalan', 'sangat', 'cepat', 'harganya', 'juga', 'dapat', 'diterima', 'saya', 'puas']","['kualitas', 'ponsel', 'asli', 'berjalan', 'cepat', 'harganya', 'diterima', 'puas']",kualitas ponsel sangat baik ini asli jalan sangat cepat harga juga dapat terima saya puas
"['barang', 'sesuai', 'seller', 'responsif', 'harga', 'sesuai', 'barang', 'gaada', 'kendala', 'pengiriman', 'cepat', 'mantap', 'pokonya', 'sukses', 'selalu']","['barang', 'sesuai', 'seller', 'responsif', 'harga', 'sesuai', 'barang', 'gaada', 'kendala', 'pengiriman', 'cepat', 'mantap', 'pokonya', 'sukses']",barang sesuai seller responsif harga sesuai barang gaada kendala kirim cepat mantap poko sukses selalu
"['ponsel', 'ini', 'sangat', 'tipis', 'dan', 'tidak', 'panas', 'saat', 'digunakan', 'warnanya', 'sangat', 'bagus', 'ukurannya', 'pas', 'dan', 'gambarnya', 'bagus']","['ponsel', 'tipis', 'panas', 'warnanya', 'bagus', 'ukurannya', 'pas', 'gambarnya', 'bagus']",ponsel ini sangat tipis dan tidak panas saat guna warna sangat bagus ukur pas dan gambar bagus
"['sangat', 'baik']",[],sangat baik
"['respon', 'sangat', 'baik', 'pengemasan', 'aman', 'dan', 'pengiriman', 'juga', 'standar', 'yang', 'tersedia', 'puas', 'terima kasih', 'salam', 'sukses']","['respon', 'pengemasan', 'aman', 'pengiriman', 'standar', 'tersedia', 'puas', 'terima kasih', 'salam', 'sukses']",respon sangat baik emas aman dan kirim juga standar yang sedia puas terima kasih salam sukses
"['paket', 'saya', 'sudah', 'sampai', 'ya', 'ka', 'semuanya', 'aman', 'ko', 'tidak', 'ada', 'yang', 'rusak', 'sama', 'sekali', 'terus', 'juga', 'pengiriman', 'juga', 'cepet', 'banget', 'saya', 'suka', 'banget', 'sama', 'toko', 'ini', 'saya', 'pasti', 'bakalan', 'rekomendasi']","['paket', 'ya', 'ka', 'aman', 'ko', 'rusak', 'pengiriman', 'cepet', 'banget', 'suka', 'banget', 'toko', 'rekomendasi']",paket saya sudah sampai ya ka semua aman ko tidak ada yang rusak sama sekali terus juga kirim juga cepet banget saya suka banget sama toko ini saya pasti bakal rekomendasi
"['alhamdulillah', 'paketnyaa', 'sudah', 'nyampe', 'dengan', 'selamat', 'barangnya', 'lengkap', 'dan', 'packingnyaa', 'juga', 'safety', 'kecepatan', 'pengiriman', 'lumayan', 'cepat', 'hp', 'juga', 'berfungsi', 'dengan', 'baik', 'ditmbh', 'dengan']","['alhamdulillah', 'paketnyaa', 'nyampe', 'selamat', 'barangnya', 'lengkap', 'packingnyaa', 'safety', 'kecepatan', 'pengiriman', 'lumayan', 'cepat', 'hp', 'berfungsi', 'ditmbh']",alhamdulillah paketnyaa sudah nyampe dengan selamat barang lengkap dan packingnyaa juga safety cepat kirim lumayan cepat hp juga fungsi dengan baik ditmbh dengan
"['alhamdulillah', 'hp', 'sampe', 'dengan', 'selamat', 'tidak', 'lecet', 'sedikitpun', 'packing', 'pakai', 'bubble', 'wrap', 'jadi', 'aman', 'sesuai', 'pesanan', 'paket', 'nya', 'bungkus', 'nya', 'sangat', 'rapi', 'hp', 'nya', 'bagus', 'terima']","['alhamdulillah', 'hp', 'sampe', 'selamat', 'lecet', 'sedikitpun', 'packing', 'pakai', 'bubble', 'wrap', 'aman', 'sesuai', 'pesanan', 'paket', 'nya', 'bungkus', 'nya', 'rapi', 'hp', 'nya', 'bagus', 'terima']",alhamdulillah hp sampe dengan selamat tidak lecet sedikit packing pakai bubble wrap jadi aman sesuai pesan paket nya bungkus nya sangat rapi hp nya bagus terima
"['daya', 'tahan', 'baterai', 'ponsel', 'ini', 'sangat', 'baikdan', 'baterai', 'nya', 'bisa', 'bertahan', 'sehariankecepatan', 'larinya', 'semulus', 'yang', 'di', 'jelaskan', 'dan', 'saya', 'telah', 'menggunakannnya', 'selama', 'beberapa']","['daya', 'tahan', 'baterai', 'ponsel', 'baikdan', 'baterai', 'nya', 'bertahan', 'sehariankecepatan', 'larinya', 'semulus', 'menggunakannnya']",daya tahan baterai ponsel ini sangat baikdan baterai nya bisa tahan sehariankecepatan lari mulus yang di jelas dan saya telah menggunakannnya lama beberapa
"['bagus', 'hpnya', 'mengkilap', 'mulus', 'semoga', 'saja', 'awet', 'berfungsi', 'dengan', 'baik']","['bagus', 'hpnya', 'mengkilap', 'mulus', 'semoga', 'awet', 'berfungsi']",bagus hpnya kilap mulus moga saja awet fungsi dengan baik
"['harganya', 'terjangkau', 'dan', 'kecepatan', 'jaringan', 'berjalan', 'cepat', 'piksel', 'kamera', 'juga', 'bagus', 'dan', 'jelas']","['harganya', 'terjangkau', 'kecepatan', 'jaringan', 'berjalan', 'cepat', 'piksel', 'kamera', 'bagus']",harga jangkau dan cepat jaring jalan cepat piksel kamera juga bagus dan jelas
"['layanan', 'penjual', 'sangat', 'baik', 'kualitas', 'produk', 'juga', 'baik', 'harga', 'juga', 'menguntungkan', 'juga', 'sangat', 'tahan', 'lama', 'warnanya', 'juga', 'bagus', 'bagus']","['layanan', 'penjual', 'kualitas', 'produk', 'harga', 'menguntungkan', 'tahan', 'warnanya', 'bagus', 'bagus']",layan jual sangat baik kualitas produk juga baik harga juga untung juga sangat tahan lama warna juga bagus bagus
"['kecepatan', 'berjalan', 'juga', 'semulus', 'yang', 'di', 'jelaskansaya', 'tidak', 'memiliki', 'fenomena', 'gagap', 'selama', 'beberapa', 'hari', 'menyarankan', 'untuk', 'membeli', 'pujiani']","['kecepatan', 'berjalan', 'semulus', 'jelaskansaya', 'memiliki', 'fenomena', 'gagap', 'menyarankan', 'membeli', 'pujiani']",cepat jalan juga mulus yang di jelaskansaya tidak milik fenomena gagap lama beberapa hari saran untuk beli pujiani
"['warna', 'hpnya', 'bagushp', 'mulus', 'tidak', 'nyesel', 'belanja', 'disini', 'semoga', 'bisa', 'bermanfaat', 'dan', 'awetseller', 'ramah', 'sangat', 'recommended', 'buat', 'yang', 'cari', 'hp', 'bisa', 'disin']","['warna', 'hpnya', 'bagushp', 'mulus', 'nyesel', 'belanja', 'semoga', 'bermanfaat', 'awetseller', 'ramah', 'recommended', 'cari', 'hp', 'disin']",warna hpnya bagushp mulus tidak nyesel belanja sini moga bisa manfaat dan awetseller ramah sangat recommended buat yang cari hp bisa sin
"['logistiknya', 'kuat', 'kemasannya', 'cantik', 'tabletnya', 'sudah', 'dipakai', 'download', 'softwarenya', 'nonton', 'acara', 'tvnya', 'lancar', 'banget', 'harganya', 'masuk', 'akal', 'dan', 'hemat', 'biaya', 'puas']","['logistiknya', 'kuat', 'kemasannya', 'cantik', 'tabletnya', 'dipakai', 'download', 'softwarenya', 'nonton', 'acara', 'tvnya', 'lancar', 'banget', 'harganya', 'masuk', 'akal', 'hemat', 'biaya', 'puas']",logistik kuat kemas cantik tablet sudah pakai download softwarenya nonton acara tvnya lancar banget harga masuk akal dan hemat biaya puas
"['sungguh', 'beruntung', 'bisa', 'membeli', 'tablet', 'sebagus', 'ini', 'dengan', 'harga', 'segitu', 'dan', 'lebih', 'beruntungnya', 'lagi', 'tablet', 'ini', 'mudah', 'digunakan', 'dan', 'memiliki', 'fungsi', 'yang', 'lengkap']","['sungguh', 'beruntung', 'membeli', 'tablet', 'sebagus', 'harga', 'segitu', 'beruntungnya', 'tablet', 'mudah', 'memiliki', 'fungsi', 'lengkap']",sungguh untung bisa beli tablet bagus ini dengan harga segitu dan lebih untung lagi tablet ini mudah guna dan milik fungsi yang lengkap
"['barang', 'sudah', 'diterima', 'dengan', 'baik', 'dan', 'sesuai', 'pesanan', 'semoga', 'barangnya', 'awet', 'terima', 'kasih', 'dan', 'seller']","['barang', 'diterima', 'sesuai', 'pesanan', 'semoga', 'barangnya', 'awet', 'terima', 'kasih', 'seller']",barang sudah terima dengan baik dan sesuai pesan moga barang awet terima kasih dan seller
"['kerenkemasan', 'nya', 'rapi', 'double', 'wrapbuat', 'senam', 'mantabmurah', 'yp', 'murahan', 'penjual', 'ramah', 'kurir', 'kg', 'ramah', 'pengiriman', 'cepat', 'semoga', 'selalu', 'amanah']","['kerenkemasan', 'nya', 'rapi', 'double', 'wrapbuat', 'senam', 'mantabmurah', 'yp', 'murahan', 'penjual', 'ramah', 'kurir', 'kg', 'ramah', 'pengiriman', 'cepat', 'semoga', 'amanah']",kerenkemasan nya rapi double wrapbuat senam mantabmurah yp murah jual ramah kurir kg ramah kirim cepat moga selalu amanah
"['kualitas', 'produk', 'yang', 'sangat', 'baik', 'pelayanan', 'yang', 'baik', 'semuanya', 'sudah', 'ada', 'tablet', 'berfungsi', 'dengan', 'baik', 'pesanan', 'di', 'sini', 'saya', 'sudah', 'membeli', 'cpð\x9f\x99\x8fð\x9f\x99\x8f']","['kualitas', 'produk', 'pelayanan', 'tablet', 'berfungsi', 'pesanan', 'membeli', 'cpð\x9f\x99\x8fð\x9f\x99\x8f']",kualitas produk yang sangat baik layan yang baik semua sudah ada tablet fungsi dengan baik pesan di sini saya sudah beli cp
"['barang', 'sampai', 'dengan', 'selamat', 'isi', 'lengkap', 'warna', 'cakep', 'mantap', 'pokok', 'nya', 'pengiriman', 'cepat', 'adm', 'nya', 'ramah', 'terima kasih', 'seller']","['barang', 'selamat', 'isi', 'lengkap', 'warna', 'cakep', 'mantap', 'pokok', 'nya', 'pengiriman', 'cepat', 'adm', 'nya', 'ramah', 'terima kasih', 'seller']",barang sampai dengan selamat isi lengkap warna cakep mantap pokok nya kirim cepat adm nya ramah terima kasih seller
"['sipp', 'banget', 'suka', 'kalau', 'respon', 'cepet', 'kiriman', 'juga', 'cepet', 'barang', 'normal', 'tidak', 'ada', 'kendala', 'dan', 'sesuai', 'pesanan', 'jual', 'buat', 'tokoð\x9f\x91\x8dð\x9f\x91\x8dð\x9f\x91\x8d']","['sipp', 'banget', 'suka', 'respon', 'cepet', 'kiriman', 'cepet', 'barang', 'normal', 'kendala', 'sesuai', 'pesanan', 'jual', 'tokoð\x9f\x91\x8dð\x9f\x91\x8dð\x9f\x91\x8d']",sipp banget suka kalau respon cepet kirim juga cepet barang normal tidak ada kendala dan sesuai pesan jual buat toko
"['mantul', 'sudah', 'kedua', 'kalinya', 'belanja', 'disini', 'tidak', 'mengecewakan', 'sangat', 'lengkap', 'dan', 'semua', 'berjalan', 'dengan', 'baik', 'pas', 'dicoba', 'semuanya', 'aman', 'terkendali', 'kelengkapan', 'nya', 'semua', 'berjala']","['mantul', 'kalinya', 'belanja', 'mengecewakan', 'lengkap', 'berjalan', 'pas', 'dicoba', 'aman', 'terkendali', 'kelengkapan', 'nya', 'berjala']",mantul sudah dua kali belanja sini tidak kecewa sangat lengkap dan semua jalan dengan baik pas coba semua aman kendali lengkap nya semua jala
"['suka', 'banget', 'sama', 'toko', 'ini', 'respon', 'penjual', 'nya', 'cepat', 'barang', 'juga', 'bagus', 'terjamin', 'dehh', 'tidak', 'akan', 'nyesel', 'recommended', 'seller', 'emang', 'tidak', 'pernah', 'salah', 'ð\x9f\x99\x8f']","['suka', 'banget', 'toko', 'respon', 'penjual', 'nya', 'cepat', 'barang', 'bagus', 'terjamin', 'dehh', 'nyesel', 'recommended', 'seller', 'emang', 'salah', 'ð\x9f\x99\x8f']",suka banget sama toko ini respon jual nya cepat barang juga bagus jamin dehh tidak akan nyesel recommended seller emang tidak pernah salah 
"['barang', 'dah', 'sampe', 'pengiriman', 'cepat', 'packing', 'rapi', 'dan', 'aman', 'barang', 'kondisi', 'segel', 'ini', 'baru', 'coba', 'dibuka', 'semoga', 'tidak', 'ada', 'kendala', 'dan', 'berfungsi', 'baik', 'semuanya', 'terima kasih']","['barang', 'dah', 'sampe', 'pengiriman', 'cepat', 'packing', 'rapi', 'aman', 'barang', 'kondisi', 'segel', 'coba', 'dibuka', 'semoga', 'kendala', 'berfungsi', 'terima kasih']",barang dah sampe kirim cepat packing rapi dan aman barang kondisi segel ini baru coba buka moga tidak ada kendala dan fungsi baik semua terima kasih
"['wahh', 'mantul', 'ja', 'hp', 'nya', 'bagus', 'sesuai', 'deskripsi', 'berfungsi', 'dengan', 'baik', 'sudah', 'dicoba', 'dan', 'sangat', 'puas', 'belanja', 'disini', 'semuanya', 'oke', 'harga', 'terjangkau', 'terima kasih', 'banyak', 'seller', 'sudah']","['wahh', 'mantul', 'ja', 'hp', 'nya', 'bagus', 'sesuai', 'deskripsi', 'berfungsi', 'dicoba', 'puas', 'belanja', 'oke', 'harga', 'terjangkau', 'terima kasih', 'seller']",wahh mantul ja hp nya bagus sesuai deskripsi fungsi dengan baik sudah coba dan sangat puas belanja sini semua oke harga jangkau terima kasih banyak seller sudah
"['alhamdulillah', 'barang', 'sampai', 'dengan', 'selamat', 'dan', 'sukses', 'seller', 'nya', 'baik', 'dan', 'pengemasan', 'nya', 'juga', 'cepat', 'pengemasan', 'nya', 'sudah', 'cepat', 'hp', 'berfungsi', 'dgn', 'baik', 'dan', 'bagus']","['alhamdulillah', 'barang', 'selamat', 'sukses', 'seller', 'nya', 'pengemasan', 'nya', 'cepat', 'pengemasan', 'nya', 'cepat', 'hp', 'berfungsi', 'dgn', 'bagus']",alhamdulillah barang sampai dengan selamat dan sukses seller nya baik dan emas nya juga cepat emas nya sudah cepat hp fungsi dgn baik dan bagus
"['baguw', 'pengemasan', 'aman', 'hpnya', 'mantaap', 'dengan', 'harga', 'murah', 'tetapi', 'pengannganya', 'mantap', 'banget', 'sudah', 'dapet', 'charger', 'case', 'dan', 'bahkan', 'anti', 'gores', 'wow', 'keren', 'overall', 'fine', 'swmoga', 'mertua', 'ku']","['baguw', 'pengemasan', 'aman', 'hpnya', 'mantaap', 'harga', 'murah', 'pengannganya', 'mantap', 'banget', 'dapet', 'charger', 'case', 'anti', 'gores', 'wow', 'keren', 'overall', 'fine', 'swmoga', 'mertua', 'ku']",baguw emas aman hpnya mantaap dengan harga murah tetapi pengannganya mantap banget sudah dapet charger case dan bahkan anti gores wow keren overall fine swmoga mertua ku
"['alhamdulilah', 'hpnya', 'sudah', 'dtang', 'dengan', 'bagus', 'tidak', 'lecet', 'penjualnya', 'respon', 'gercep', 'smga', 'awet', 'hpnya']","['alhamdulilah', 'hpnya', 'dtang', 'bagus', 'lecet', 'penjualnya', 'respon', 'gercep', 'smga', 'awet', 'hpnya']",alhamdulilah hpnya sudah dtang dengan bagus tidak lecet jual respon gercep smga awet hpnya
"['puasbarang', 'cepat', 'sampai', 'tanpa', 'cacat', 'respon', 'penjual', 'juga', 'cepat']","['puasbarang', 'cepat', 'cacat', 'respon', 'penjual', 'cepat']",puasbarang cepat sampai tanpa cacat respon jual juga cepat
"['barang', 'sudah', 'datang', 'kelengkapana', 'sesuai', 'dan', 'berfungsi', 'dengan', 'baik', 'ternyata', 'ram', 'nya', 'cm', 'gb', 'hehe']","['barang', 'kelengkapana', 'sesuai', 'berfungsi', 'ram', 'nya', 'cm', 'gb', 'hehe']",barang sudah datang kelengkapana sesuai dan fungsi dengan baik nyata ram nya cm gb hehe
"['bagus', 'oke', 'barangnya', 'ni']","['bagus', 'oke', 'barangnya', 'ni']",bagus oke barang ni
"['alhamdulillah', 'sampai', 'dgn', 'selamat', 'terima kasih', 'ð\x9f\x99\x8f']","['alhamdulillah', 'dgn', 'selamat', 'terima kasih', 'ð\x9f\x99\x8f']",alhamdulillah sampai dgn selamat terima kasih 
"['ini', 'produk', 'jadul', 'namun', 'harga', 'lumayan', 'tinggi', 'pilihan', 'jaringan', 'tidak', 'otomatis', 'walaupun', 'ada', 'jaringan', 'tetapi', 'itu', 'tidak', 'fungsi', 'dan', 'ketika', 'mau', 'putar', 'youtube', 'ternyata', 'tidak', 'bisa', 'aks']","['produk', 'jadul', 'harga', 'lumayan', 'pilihan', 'jaringan', 'otomatis', 'jaringan', 'fungsi', 'putar', 'youtube', 'aks']",ini produk jadul namun harga lumayan tinggi pilih jaring tidak otomatis walaupun ada jaring tetapi itu tidak fungsi dan ketika mau putar youtube nyata tidak bisa aks
"['sungguh', 'luar', 'biasa', 'pengalaman', 'berbelanja', 'di', 'toko', 'ini', 'sangat', 'bagus', 'anda', 'tidak', 'dapat', 'membeli', 'ponsel', 'yang', 'lebih', 'baik', 'dengan', 'harga', 'ini']","['sungguh', 'pengalaman', 'berbelanja', 'toko', 'bagus', 'membeli', 'ponsel', 'harga']",sungguh luar biasa alam belanja di toko ini sangat bagus anda tidak dapat beli ponsel yang lebih baik dengan harga ini
"['sangat', 'bagus', 'toko', 'membalas', 'pesan', 'tepat', 'waktu', 'ponselnya', 'juga', 'sangat', 'bagus', 'harganya', 'murah', 'untuk', 'harga', 'ini', 'ini', 'adalah', 'ponsel', 'yang', 'sangat', 'bagus']","['bagus', 'toko', 'membalas', 'pesan', 'ponselnya', 'bagus', 'harganya', 'murah', 'harga', 'ponsel', 'bagus']",sangat bagus toko balas pesan tepat waktu ponselnya juga sangat bagus harga murah untuk harga ini ini adalah ponsel yang sangat bagus
"['barang', 'sampai', 'dengan', 'selamat', 'bagus', 'dan', 'harga', 'bersahabatt']","['barang', 'selamat', 'bagus', 'harga', 'bersahabatt']",barang sampai dengan selamat bagus dan harga bersahabatt
"['barang', 'sudah', 'sampai', 'dengan', 'aman', 'sesuai', 'pesanan', 'dan', 'kurir', 'nya', 'baik']","['barang', 'aman', 'sesuai', 'pesanan', 'kurir', 'nya']",barang sudah sampai dengan aman sesuai pesan dan kurir nya baik
"['terima', 'kasih', 'barang', 'sudah', 'sampai', 'packingnya', 'aman', 'dan', 'rapi', 'barangnya', 'bagus', 'dan', 'berfungsi', 'dengan', 'baik', 'sukses', 'terus', 'untuk', 'resellersemoga', 'awet']","['terima', 'kasih', 'barang', 'packingnya', 'aman', 'rapi', 'barangnya', 'bagus', 'berfungsi', 'sukses', 'resellersemoga', 'awet']",terima kasih barang sudah sampai packingnya aman dan rapi barang bagus dan fungsi dengan baik sukses terus untuk resellersemoga awet
"['alhamdulillah', 'barang', 'dikirim', 'sesuai', 'pesanan', 'warnanya', 'juga', 'tidak', 'salah', 'baru', 'ini', 'nemu', 'toko', 'yang', 'amanah', 'dan', 'terpercaya', 'bgttt', 'terima kasih', 'banyak', 'untuk', 'seller', 'top', 'bgttt', 'dehhhð\x9f\x98\x8d']","['alhamdulillah', 'barang', 'dikirim', 'sesuai', 'pesanan', 'warnanya', 'salah', 'nemu', 'toko', 'amanah', 'terpercaya', 'bgttt', 'terima kasih', 'seller', 'top', 'bgttt', 'dehhhð\x9f\x98\x8d']",alhamdulillah barang kirim sesuai pesan warna juga tidak salah baru ini nemu toko yang amanah dan percaya bgttt terima kasih banyak untuk seller top bgttt dehhh
"['alhamdulillah', 'barangnya', 'sudah', 'nyampe', 'dengan', 'selamat', 'barang', 'yang', 'dikirim', 'sudah', 'sesuai', 'sama', 'orderan', 'barangnya', 'mulus', 'dan', 'bagus', 'pengemasan', 'baik', 'dan', 'aman', 'banget', 'pengiriman']","['alhamdulillah', 'barangnya', 'nyampe', 'selamat', 'barang', 'dikirim', 'sesuai', 'orderan', 'barangnya', 'mulus', 'bagus', 'pengemasan', 'aman', 'banget', 'pengiriman']",alhamdulillah barang sudah nyampe dengan selamat barang yang kirim sudah sesuai sama order barang mulus dan bagus emas baik dan aman banget kirim
"['sangat', 'puas', 'sesuai', 'deskripsi', 'jangan', 'ragu', 'untuk', 'membeli', 'di', 'toko', 'ini', 'karena', 'amanah', 'dan', 'pengiriman', 'juga', 'sangat', 'cepat', 'pesanan', 'tiba', 'sore', 'berikutnya', 'penjual', 'juga', 'ramah', 'dan']","['puas', 'sesuai', 'deskripsi', 'ragu', 'membeli', 'toko', 'amanah', 'pengiriman', 'cepat', 'pesanan', 'sore', 'penjual', 'ramah']",sangat puas sesuai deskripsi jangan ragu untuk beli di toko ini karena amanah dan kirim juga sangat cepat pesan tiba sore ikut jual juga ramah dan
"['harganya', 'murah', 'banget', 'kualitasnya', 'keren', 'abiss', 'cepet', 'banget', 'sampainya', 'kurirnya', 'baik', 'banget', 'toko', 'nya', 'juga', 'benar', 'benar', 'tanggung', 'jawab', 'sama', 'pesanan', 'kita', 'pesenanya', 'semuanya', 'benar']","['harganya', 'murah', 'banget', 'kualitasnya', 'keren', 'abiss', 'cepet', 'banget', 'sampainya', 'kurirnya', 'banget', 'toko', 'nya', 'tanggung', 'pesanan', 'pesenanya']",harga murah banget kualitas keren abiss cepet banget sampai kurir baik banget toko nya juga benar benar tanggung jawab sama pesan kita sena semua benar
"['respon', 'sangat', 'baik', 'pengemasan', 'aman', 'dan', 'pengiriman', 'juga', 'standar', 'yang', 'tersedia', 'puas', 'terima kasih', 'salam', 'sukses']","['respon', 'pengemasan', 'aman', 'pengiriman', 'standar', 'tersedia', 'puas', 'terima kasih', 'salam', 'sukses']",respon sangat baik emas aman dan kirim juga standar yang sedia puas terima kasih salam sukses
"['alhamdulillah', 'hp', 'sampe', 'dengan', 'selamat', 'tidak', 'lecet', 'sedikitpun', 'packing', 'pakai', 'bubble', 'wrap', 'jadi', 'aman', 'sesuai', 'pesanan', 'paket', 'nya', 'bungkus', 'nya', 'sangat', 'rapi', 'hp', 'nya', 'bagus', 'terima']","['alhamdulillah', 'hp', 'sampe', 'selamat', 'lecet', 'sedikitpun', 'packing', 'pakai', 'bubble', 'wrap', 'aman', 'sesuai', 'pesanan', 'paket', 'nya', 'bungkus', 'nya', 'rapi', 'hp', 'nya', 'bagus', 'terima']",alhamdulillah hp sampe dengan selamat tidak lecet sedikit packing pakai bubble wrap jadi aman sesuai pesan paket nya bungkus nya sangat rapi hp nya bagus terima
"['paket', 'saya', 'sudah', 'sampai', 'ya', 'ka', 'semuanya', 'aman', 'ko', 'tidak', 'ada', 'yang', 'rusak', 'sama', 'sekali', 'terus', 'juga', 'pengiriman', 'juga', 'cepet', 'banget', 'saya', 'suka', 'banget', 'sama', 'toko', 'ini', 'saya', 'pasti', 'bakalan', 'rekomendasi']","['paket', 'ya', 'ka', 'aman', 'ko', 'rusak', 'pengiriman', 'cepet', 'banget', 'suka', 'banget', 'toko', 'rekomendasi']",paket saya sudah sampai ya ka semua aman ko tidak ada yang rusak sama sekali terus juga kirim juga cepet banget saya suka banget sama toko ini saya pasti bakal rekomendasi
"['kualitas', 'oke', 'harga', 'oke', 'penjual', 'tanggap', 'tidak', 'kecewa', 'sama', 'sekali', 'beli', 'di', 'toko', 'ini', 'dikemas', 'dengan', 'rapi', 'hh', 'pengiriman', 'cepat']","['kualitas', 'oke', 'harga', 'oke', 'penjual', 'tanggap', 'kecewa', 'beli', 'toko', 'dikemas', 'rapi', 'hh', 'pengiriman', 'cepat']",kualitas oke harga oke jual tanggap tidak kecewa sama sekali beli di toko ini kemas dengan rapi hh kirim cepat
"['bentuknya', 'sangat', 'indah', 'suasana', 'yang', 'bergaya', 'kualitas', 'suaranya', 'jelas', 'volume', 'ya', 'besar', 'musik', 'ya', 'jelas', 'kata', 'itu', 'sangat', 'jelas', 'ingat', 'ya', 'juga', 'cukup', 'besar', 'tidak', 'ada']","['bentuknya', 'indah', 'suasana', 'bergaya', 'kualitas', 'suaranya', 'volume', 'ya', 'musik', 'ya', 'ya']",bentuk sangat indah suasana yang gaya kualitas suara jelas volume ya besar musik ya jelas kata itu sangat jelas ingat ya juga cukup besar tidak ada
"['alhamdulilah', 'hp', 'aman', 'original', 'baru', 'foto', 'jauh', 'lebih', 'jelas', 'dari', 'hp', 'yang', 'saya', 'pakai', 'sekarang', 'seller', 'kasih', 'case', 'hp', 'dan', 'tempered', 'film', 'walaupun', 'hp', 'sangat', 'murah', 'tetapi', 'kualita']","['alhamdulilah', 'hp', 'aman', 'original', 'foto', 'hp', 'pakai', 'seller', 'kasih', 'case', 'hp', 'tempered', 'film', 'hp', 'murah', 'kualita']",alhamdulilah hp aman original baru foto jauh lebih jelas dari hp yang saya pakai sekarang seller kasih case hp dan tempered film walaupun hp sangat murah tetapi kualita
"['hp', 'super', 'lemot', 'tidak', 'seperti', 'ram', '/', 'not', 'recommended', 'seller']","['hp', 'super', 'lemot', 'ram', '/', 'not', 'recommended', 'seller']",hp super lot tidak seperti ram  not recommended seller
"['layanan', 'bagus', 'lgs', 'direspon', 'dan', 'barang', 'lgs', 'dikirim', 'terima kasih']","['layanan', 'bagus', 'lgs', 'direspon', 'barang', 'lgs', 'dikirim', 'terima kasih']",layan bagus lgs direspon dan barang lgs kirim terima kasih
"['hati', 'hp', 'tidak', 'seperti', 'harapan', 'saya', 'lambat', 'fan', 'aksesvilitasnya', 'kurang', 'merk', 'hp', 'tidak', 'ke', 'baca']","['hati', 'hp', 'harapan', 'lambat', 'fan', 'aksesvilitasnya', 'merk', 'hp', 'baca']",hati hp tidak seperti harap saya lambat fan aksesvilitasnya kurang merk hp tidak ke baca
['oke'],['oke'],oke
"['barangnya', 'ok', 'pengiriman', 'juga', 'ok']","['barangnya', 'ok', 'pengiriman', 'ok']",barang ok kirim juga ok
"['dikirim', 'dalam', 'keadaan', 'baik', 'tetapi', 'warna', 'tidak', 'di', 'kasih', 'sesuai']","['dikirim', 'warna', 'kasih', 'sesuai']",kirim dalam ada baik tetapi warna tidak di kasih sesuai
"['packing', 'rapih', 'proses', 'penerimaan', 'order', 'sampai', 'pengiriman', 'sangat', 'cepat', 'barang', 'komplit', 'plus', 'bonusnya', 'untuk', 'unitnya', 'sendiri', 'baik', 'semua', 'apk', 'bisa', 'berjalan', 'lancar', 'batere']","['packing', 'rapih', 'proses', 'penerimaan', 'order', 'pengiriman', 'cepat', 'barang', 'komplit', 'plus', 'bonusnya', 'unitnya', 'apk', 'berjalan', 'lancar', 'batere']",packing rapih proses terima order sampai kirim sangat cepat barang komplit plus bonus untuk unit sendiri baik semua apk bisa jalan lancar batere
"['baru', 'sampe', 'baru', 'mau', 'di', 'buka', 'bungkusnya', 'dan', 'belum', 'di', 'coba', 'hpnyamudah', 'mudahan', 'bagus', 'ya']","['sampe', 'buka', 'bungkusnya', 'coba', 'hpnyamudah', 'mudahan', 'bagus', 'ya']",baru sampe baru mau di buka bungkus dan belum di coba hpnyamudah mudah bagus ya
"['mantappp', 'sesuai', 'pesananlangsung', 'dikirimcepat', 'sampainyamksh']","['mantappp', 'sesuai', 'pesananlangsung', 'dikirimcepat', 'sampainyamksh']",mantappp sesuai pesananlangsung dikirimcepat sampainyamksh
"['hape', 'sudah', 'kami', 'terima', 'harga', 'hp', 'memang', 'murahdan', 'kualitas', 'memang', 'sesuai', 'harga', 'spek', 'yang', 'tertulis', 'di', 'deskripsi', 'pastinya', 'tidak', 'akan', 'sama', 'dengan', 'kualitas', 'dari', 'reno', 'aslin']","['hape', 'terima', 'harga', 'hp', 'murahdan', 'kualitas', 'sesuai', 'harga', 'spek', 'tertulis', 'deskripsi', 'pastinya', 'kualitas', 'reno', 'aslin']",hape sudah kami terima harga hp memang murahdan kualitas memang sesuai harga spek yang tulis di deskripsi pasti tidak akan sama dengan kualitas dari reno aslin
"['barangnya', 'dah', 'sampe', 'sesuai', 'pesanan', 'terima kasih']","['barangnya', 'dah', 'sampe', 'sesuai', 'pesanan', 'terima kasih']",barang dah sampe sesuai pesan terima kasih
"['bonusnya', 'sesuai', 'dengan', 'keterangan', 'sellernya', 'fast', 'response', 'bersabar', 'menjelaskan', 'jadi', 'tenang', 'buat', 'tanya', 'tanya']","['bonusnya', 'sesuai', 'keterangan', 'sellernya', 'fast', 'response', 'bersabar', 'tenang']",bonus sesuai dengan terang sellernya fast response sabar jelas jadi tenang buat tanya tanya
"['kemasannya', 'sangat', 'hati-hati', 'dan', 'ketat', 'dan', 'pelayanan', 'perusahaan', 'logistik', 'baik']","['kemasannya', 'hati-hati', 'ketat', 'pelayanan', 'perusahaan', 'logistik']",kemas sangat hati dan ketat dan layan usaha logistik baik
"['terima', 'kasih', 'dikirim', 'sesuai', 'pesanan', 'terima', 'kasih', 'kakak', 'god', 'bless', 'you', 'always']","['terima', 'kasih', 'dikirim', 'sesuai', 'pesanan', 'terima', 'kasih', 'kakak', 'god', 'bless', 'you', 'always']",terima kasih kirim sesuai pesan terima kasih kakak god bless you always
